{
  "$schema": "./bodies.schema.json",
  "$comment": "The single source of truth for every body Demiurge simulates. Validated against bodies.schema.json at load and in CI. Radii, GM, rotation and pole data come from the NASA planetary fact sheets and the IAU WGCCRE report; orbital elements come from JPL as cited per body. Angles are in degrees here because that is how every citable table publishes them, and a transcription is easier to check against its source when the numbers still look like the source. See docs/astronomy.md.",
  "epoch": "J2000.0 (JD 2451545.0 TT)",
  "sources": {
    "standish": "Standish, Keplerian Elements for Approximate Positions of the Major Planets, JPL Solar System Dynamics. Table 1, fitted 1800-2050 AD.",
    "horizons": "JPL Horizons osculating elements at 2000-01-01 12:00 TDB, parent-centred, referred to the ecliptic and equinox of J2000. Public domain.",
    "factSheets": "NASA planetary fact sheets, nssdc.gsfc.nasa.gov.",
    "wgccre": "Archinal et al., Report of the IAU Working Group on Cartographic Coordinates and Rotational Elements."
  },
  "bodies": [
    {
      "id": "sun",
      "name": "Sun",
      "kind": "star",
      "parent": null,
      "equatorialRadiusKm": 695700,
      "polarRadiusKm": 695700,
      "gravitationalParameterKm3PerS2": 132712440041.279419,
      "rotationPeriodDays": 25.38,
      "poleRightAscensionDeg": 286.13,
      "poleDeclinationDeg": 63.87,
      "primeMeridianDeg": 84.176,
      "primeMeridianRateDegPerDay": 14.1844,
      "albedo": 0,
      "orbit": null
    },
    {
      "id": "mercury",
      "name": "Mercury",
      "kind": "planet",
      "parent": "sun",
      "equatorialRadiusKm": 2440.53,
      "polarRadiusKm": 2438.26,
      "gravitationalParameterKm3PerS2": 22031.868551,
      "rotationPeriodDays": 58.6462,
      "poleRightAscensionDeg": 281.0103,
      "poleDeclinationDeg": 61.4155,
      "primeMeridianDeg": 329.5988,
      "primeMeridianRateDegPerDay": 6.1385108,
      "albedo": 0.142,
      "orbit": {
        "form": "standish",
        "source": "standish",
        "semiMajorAxisAu": 0.38709927,
        "eccentricity": 0.20563593,
        "inclinationDeg": 7.00497902,
        "meanLongitudeDeg": 252.2503235,
        "longitudeOfPerihelionDeg": 77.45779628,
        "longitudeOfAscendingNodeDeg": 48.33076593,
        "semiMajorAxisRateAuPerCentury": 0.00000037,
        "eccentricityRatePerCentury": 0.00001906,
        "inclinationRateDegPerCentury": -0.00594749,
        "meanLongitudeRateDegPerCentury": 149472.67411175,
        "longitudeOfPerihelionRateDegPerCentury": 0.16047689,
        "longitudeOfAscendingNodeRateDegPerCentury": -0.12534081
      }
    },
    {
      "id": "venus",
      "name": "Venus",
      "kind": "planet",
      "parent": "sun",
      "equatorialRadiusKm": 6051.8,
      "polarRadiusKm": 6051.8,
      "gravitationalParameterKm3PerS2": 324858.592,
      "rotationPeriodDays": -243.018,
      "poleRightAscensionDeg": 272.76,
      "poleDeclinationDeg": 67.16,
      "primeMeridianDeg": 160.2,
      "primeMeridianRateDegPerDay": -1.4813688,
      "albedo": 0.689,
      "orbit": {
        "form": "standish",
        "source": "standish",
        "semiMajorAxisAu": 0.72333566,
        "eccentricity": 0.00677672,
        "inclinationDeg": 3.39467605,
        "meanLongitudeDeg": 181.9790995,
        "longitudeOfPerihelionDeg": 131.60246718,
        "longitudeOfAscendingNodeDeg": 76.67984255,
        "semiMajorAxisRateAuPerCentury": 0.0000039,
        "eccentricityRatePerCentury": -0.00004107,
        "inclinationRateDegPerCentury": -0.0007889,
        "meanLongitudeRateDegPerCentury": 58517.81538729,
        "longitudeOfPerihelionRateDegPerCentury": 0.00268329,
        "longitudeOfAscendingNodeRateDegPerCentury": -0.27769418
      }
    },
    {
      "id": "earth",
      "name": "Earth",
      "kind": "planet",
      "parent": "sun",
      "equatorialRadiusKm": 6378.137,
      "polarRadiusKm": 6356.752,
      "gravitationalParameterKm3PerS2": 398600.435507,
      "rotationPeriodDays": 0.99726968,
      "poleRightAscensionDeg": 0,
      "poleDeclinationDeg": 90,
      "primeMeridianDeg": 190.147,
      "primeMeridianRateDegPerDay": 360.9856235,
      "albedo": 0.306,
      "orbit": {
        "form": "standish",
        "source": "standish",
        "$comment": "Standish's table describes the Earth-Moon barycentre, not the Earth. The two differ by about 4700 km, which at 1 au is 0.0018 degrees of longitude - fifty times smaller than the accuracy this catalogue claims.",
        "semiMajorAxisAu": 1.00000261,
        "eccentricity": 0.01671123,
        "inclinationDeg": -0.00001531,
        "meanLongitudeDeg": 100.46457166,
        "longitudeOfPerihelionDeg": 102.93768193,
        "longitudeOfAscendingNodeDeg": 0,
        "semiMajorAxisRateAuPerCentury": 0.00000562,
        "eccentricityRatePerCentury": -0.00004392,
        "inclinationRateDegPerCentury": -0.01294668,
        "meanLongitudeRateDegPerCentury": 35999.37244981,
        "longitudeOfPerihelionRateDegPerCentury": 0.32327364,
        "longitudeOfAscendingNodeRateDegPerCentury": 0
      }
    },
    {
      "id": "mars",
      "name": "Mars",
      "kind": "planet",
      "parent": "sun",
      "equatorialRadiusKm": 3396.19,
      "polarRadiusKm": 3376.2,
      "gravitationalParameterKm3PerS2": 42828.375816,
      "rotationPeriodDays": 1.02595676,
      "poleRightAscensionDeg": 317.269202,
      "poleDeclinationDeg": 54.432516,
      "primeMeridianDeg": 176.049863,
      "primeMeridianRateDegPerDay": 350.891982443297,
      "albedo": 0.25,
      "orbit": {
        "form": "standish",
        "source": "standish",
        "semiMajorAxisAu": 1.52371034,
        "eccentricity": 0.0933941,
        "inclinationDeg": 1.84969142,
        "meanLongitudeDeg": -4.55343205,
        "longitudeOfPerihelionDeg": -23.94362959,
        "longitudeOfAscendingNodeDeg": 49.55953891,
        "semiMajorAxisRateAuPerCentury": 0.00001847,
        "eccentricityRatePerCentury": 0.00007882,
        "inclinationRateDegPerCentury": -0.00813131,
        "meanLongitudeRateDegPerCentury": 19140.30268499,
        "longitudeOfPerihelionRateDegPerCentury": 0.44441088,
        "longitudeOfAscendingNodeRateDegPerCentury": -0.29257343
      }
    },
    {
      "id": "jupiter",
      "name": "Jupiter",
      "kind": "planet",
      "parent": "sun",
      "equatorialRadiusKm": 71492,
      "polarRadiusKm": 66854,
      "gravitationalParameterKm3PerS2": 126686531.9,
      "rotationPeriodDays": 0.41354,
      "poleRightAscensionDeg": 268.056595,
      "poleDeclinationDeg": 64.495303,
      "primeMeridianDeg": 284.95,
      "primeMeridianRateDegPerDay": 870.536,
      "albedo": 0.503,
      "orbit": {
        "form": "standish",
        "source": "standish",
        "semiMajorAxisAu": 5.202887,
        "eccentricity": 0.04838624,
        "inclinationDeg": 1.30439695,
        "meanLongitudeDeg": 34.39644051,
        "longitudeOfPerihelionDeg": 14.72847983,
        "longitudeOfAscendingNodeDeg": 100.47390909,
        "semiMajorAxisRateAuPerCentury": -0.00011607,
        "eccentricityRatePerCentury": -0.00013253,
        "inclinationRateDegPerCentury": -0.00183714,
        "meanLongitudeRateDegPerCentury": 3034.74612775,
        "longitudeOfPerihelionRateDegPerCentury": 0.21252668,
        "longitudeOfAscendingNodeRateDegPerCentury": 0.20469106
      }
    },
    {
      "id": "saturn",
      "name": "Saturn",
      "kind": "planet",
      "parent": "sun",
      "equatorialRadiusKm": 60268,
      "polarRadiusKm": 54364,
      "gravitationalParameterKm3PerS2": 37931206.234,
      "rotationPeriodDays": 0.44401,
      "poleRightAscensionDeg": 40.589,
      "poleDeclinationDeg": 83.537,
      "primeMeridianDeg": 38.9,
      "primeMeridianRateDegPerDay": 810.7939024,
      "albedo": 0.342,
      "rings": {
        "innerRadiusKm": 74500,
        "outerRadiusKm": 140220,
        "$comment": "Inner edge of the C ring to the outer edge of the A ring."
      },
      "orbit": {
        "form": "standish",
        "source": "standish",
        "semiMajorAxisAu": 9.53667594,
        "eccentricity": 0.05386179,
        "inclinationDeg": 2.48599187,
        "meanLongitudeDeg": 49.95424423,
        "longitudeOfPerihelionDeg": 92.59887831,
        "longitudeOfAscendingNodeDeg": 113.66242448,
        "semiMajorAxisRateAuPerCentury": -0.0012506,
        "eccentricityRatePerCentury": -0.00050991,
        "inclinationRateDegPerCentury": 0.00193609,
        "meanLongitudeRateDegPerCentury": 1222.49362201,
        "longitudeOfPerihelionRateDegPerCentury": -0.41897216,
        "longitudeOfAscendingNodeRateDegPerCentury": -0.28867794
      }
    },
    {
      "id": "uranus",
      "name": "Uranus",
      "kind": "planet",
      "parent": "sun",
      "equatorialRadiusKm": 25559,
      "polarRadiusKm": 24973,
      "gravitationalParameterKm3PerS2": 5793951.256,
      "rotationPeriodDays": -0.71833,
      "poleRightAscensionDeg": 257.311,
      "poleDeclinationDeg": -15.175,
      "primeMeridianDeg": 203.81,
      "primeMeridianRateDegPerDay": -501.1600928,
      "albedo": 0.3,
      "rings": {
        "innerRadiusKm": 37850,
        "outerRadiusKm": 51150,
        "$comment": "Ring 6 to the epsilon ring. Narrow and very dark; opacity is low."
      },
      "orbit": {
        "form": "standish",
        "source": "standish",
        "semiMajorAxisAu": 19.18916464,
        "eccentricity": 0.04725744,
        "inclinationDeg": 0.77263783,
        "meanLongitudeDeg": 313.23810451,
        "longitudeOfPerihelionDeg": 170.9542763,
        "longitudeOfAscendingNodeDeg": 74.01692503,
        "semiMajorAxisRateAuPerCentury": -0.00196176,
        "eccentricityRatePerCentury": -0.00004397,
        "inclinationRateDegPerCentury": -0.00242939,
        "meanLongitudeRateDegPerCentury": 428.48202785,
        "longitudeOfPerihelionRateDegPerCentury": 0.40805281,
        "longitudeOfAscendingNodeRateDegPerCentury": 0.04240589
      }